{
  "$schema": "./remediation-registry.schema.json",
  "schemaVersion": "0.1.0",
  "registryVersion": "2026.09.27",
  "title": "AEE detection, analysis, and remediation registry",
  "patternSource": {
    "repository": "https://github.com/Elizabeth1979/a11y-skills",
    "commit": "e0dfbeb50b453f9fd87423a1c7d4d29c9ccc4c15",
    "path": "patterns/{pattern}.instructions.md"
  },
  "axeRulePatterns": {
    "button-name": "buttons",
    "link-name": "link",
    "identical-links-same-purpose": "link",
    "label": "forms",
    "label-title-only": "forms",
    "select-name": "forms",
    "autocomplete-valid": "forms",
    "image-alt": "image-labeling",
    "svg-img-alt": "image-labeling",
    "role-img-alt": "image-labeling",
    "empty-heading": "headings",
    "heading-order": "headings",
    "page-has-heading-one": "headings",
    "p-as-heading": "headings",
    "color-contrast": "color-contrast",
    "color-contrast-enhanced": "color-contrast",
    "link-in-text-block": "color-contrast",
    "region": "landmarks",
    "landmark-one-main": "landmarks",
    "landmark-no-duplicate-main": "landmarks",
    "landmark-no-duplicate-banner": "landmarks",
    "landmark-no-duplicate-contentinfo": "landmarks",
    "landmark-unique": "landmarks",
    "landmark-banner-is-top-level": "landmarks",
    "landmark-contentinfo-is-top-level": "landmarks",
    "bypass": "skip-links",
    "skip-link": "skip-links",
    "empty-table-header": "tables",
    "scope-attr-valid": "tables",
    "table-fake-caption": "tables",
    "td-has-header": "tables",
    "aria-dialog-name": "dialog-modal",
    "aria-meter-name": "meter",
    "aria-tab-name": "tabs",
    "aria-tooltip-name": "tooltip",
    "aria-treeitem-name": "treeview",
    "tabindex": "focus-management",
    "target-size": "target-size",
    "blink": "motion-animation",
    "marquee": "motion-animation"
  },
  "principles": [
    "Use deterministic detection and verification whenever possible.",
    "Route only allowlisted contextual questions to an AI specialist.",
    "Require synchronized full-page visual, DOM, and accessibility-tree evidence for AI analysis.",
    "Mark every AI-produced conclusion or suggestion clearly and preserve its audit trail.",
    "Never treat missing, unsupported, or contradictory evidence as a pass."
  ],
  "entries": [
    {
      "id": "accessible-name",
      "title": "Missing or unsuitable accessible name",
      "implementationStatus": "partial",
      "ruleKind": "aee-act-compatible",
      "requirements": [
        {
          "standard": "WCAG",
          "version": "2.2",
          "requirementId": "4.1.2",
          "title": "Name, Role, Value",
          "level": "A",
          "relationship": "primary",
          "url": "https://www.w3.org/WAI/WCAG22/Understanding/name-role-value.html"
        },
        {
          "standard": "axe-core",
          "version": "4.13",
          "requirementId": "button-name",
          "title": "Buttons must have discernible text",
          "relationship": "detection",
          "url": "https://dequeuniversity.com/rules/axe/4.13/button-name"
        },
        {
          "standard": "axe-core",
          "version": "4.13",
          "requirementId": "link-name",
          "title": "Links must have discernible text",
          "relationship": "detection",
          "url": "https://dequeuniversity.com/rules/axe/4.13/link-name"
        },
        {
          "standard": "axe-core",
          "version": "4.13",
          "requirementId": "label",
          "title": "Form elements must have labels",
          "relationship": "detection",
          "url": "https://dequeuniversity.com/rules/axe/4.13/label"
        }
      ],
      "patterns": ["buttons", "link", "forms"],
      "applicability": "Interactive controls and form elements whose accessible name is absent, generic, duplicated, or inconsistent with the visible purpose.",
      "requiredEvidence": [
        "axe-result",
        "full-page-screenshot",
        "viewport-screenshot",
        "dom-snapshot",
        "accessibility-tree",
        "screen-reader-transcript"
      ],
      "deterministicDetection": [
        "Run pinned axe-core rules at each meaningful checkpoint.",
        "Compute the accessible name and compare it with the rendered role and visible text."
      ],
      "ai": {
        "allowed": true,
        "required": false,
        "specialistId": "accessible-name-specialist",
        "purpose": "Suggest a concise, context-specific name when deterministic checks can prove a name problem but cannot author the wording.",
        "outputs": ["suggestedName", "rationale", "confidence", "citedEvidenceIds"]
      },
      "verification": [
        "Rerun the same journey and prove the computed name is non-empty and unique enough for the task.",
        "Match visible purpose, DOM, accessibility tree, and screen-reader output.",
        "Confirm keyboard activation and resulting user outcome are unchanged."
      ]
    },
    {
      "id": "image-purpose",
      "title": "Image purpose and text alternative",
      "implementationStatus": "planned",
      "ruleKind": "aee-act-compatible",
      "requirements": [
        {
          "standard": "WCAG",
          "version": "2.2",
          "requirementId": "1.1.1",
          "title": "Non-text Content",
          "level": "A",
          "relationship": "primary",
          "url": "https://www.w3.org/WAI/WCAG22/Understanding/non-text-content.html"
        },
        {
          "standard": "axe-core",
          "version": "4.13",
          "requirementId": "image-alt",
          "title": "Images must have alternative text",
          "relationship": "detection",
          "url": "https://dequeuniversity.com/rules/axe/4.13/image-alt"
        }
      ],
      "patterns": ["image-labeling"],
      "applicability": "Rendered images, SVGs, icons, and CSS images whose purpose depends on their relationship to surrounding content or controls.",
      "requiredEvidence": [
        "full-page-screenshot",
        "viewport-screenshot",
        "dom-snapshot",
        "accessibility-tree",
        "screen-reader-transcript"
      ],
      "deterministicDetection": [
        "Identify rendered non-text content and its exposed alternative or hidden state.",
        "Flag mechanically provable missing alternatives and role conflicts."
      ],
      "ai": {
        "allowed": true,
        "required": false,
        "specialistId": "image-purpose-specialist",
        "purpose": "Classify an image as decorative, informative, functional, or complex and draft text only when page context is required.",
        "outputs": [
          "classification",
          "suggestedAlternative",
          "rationale",
          "confidence",
          "citedEvidenceIds"
        ]
      },
      "verification": [
        "Confirm the rendered image, nearby content, DOM treatment, accessibility tree, and spoken output express the same purpose.",
        "For decorative images, verify they are absent from the accessibility tree and spoken output."
      ]
    },
    {
      "id": "heading-structure",
      "title": "Visual and semantic heading structure",
      "implementationStatus": "partial",
      "ruleKind": "aee-act-compatible",
      "requirements": [
        {
          "standard": "WCAG",
          "version": "2.2",
          "requirementId": "1.3.1",
          "title": "Info and Relationships",
          "level": "A",
          "relationship": "primary",
          "url": "https://www.w3.org/WAI/WCAG22/Understanding/info-and-relationships.html"
        },
        {
          "standard": "axe-core",
          "version": "4.13",
          "requirementId": "empty-heading",
          "title": "Headings should not be empty",
          "relationship": "detection",
          "url": "https://dequeuniversity.com/rules/axe/4.13/empty-heading"
        }
      ],
      "patterns": ["headings"],
      "applicability": "Pages where typography, spacing, grouping, or repeated regions imply a hierarchy that may differ from the semantic outline.",
      "requiredEvidence": [
        "full-page-screenshot",
        "dom-snapshot",
        "accessibility-tree",
        "screen-reader-transcript"
      ],
      "deterministicDetection": [
        "Extract the complete semantic heading outline and structural relationships.",
        "Record visual typography and grouping signals without deciding meaning.",
        "Flag, as advisory, a short line styled as a title (bold and larger than the body text, or 40% larger) that has no heading role in the accessibility tree."
      ],
      "ai": {
        "allowed": true,
        "required": false,
        "specialistId": "heading-structure-specialist",
        "purpose": "Compare the full visual hierarchy with the full DOM and accessibility-tree outline when the intended relationships require contextual judgment.",
        "outputs": [
          "proposedOutline",
          "relationshipMismatches",
          "rationale",
          "confidence",
          "citedEvidenceIds"
        ]
      },
      "verification": [
        "Re-extract the full outline after the fix.",
        "Confirm visual grouping, DOM hierarchy, accessibility tree, and screen-reader heading navigation agree."
      ]
    },
    {
      "id": "color-contrast",
      "title": "Text and component color contrast",
      "implementationStatus": "partial",
      "ruleKind": "aee-act-compatible",
      "requirements": [
        {
          "standard": "WCAG",
          "version": "2.2",
          "requirementId": "1.4.3",
          "title": "Contrast (Minimum)",
          "level": "AA",
          "relationship": "primary",
          "url": "https://www.w3.org/WAI/WCAG22/Understanding/contrast-minimum.html"
        },
        {
          "standard": "WCAG",
          "version": "2.2",
          "requirementId": "1.4.11",
          "title": "Non-text Contrast",
          "level": "AA",
          "relationship": "secondary",